### ISSUE TITLE
when connecting to https by IP address, client hello message has a server_name SNI block with literal ip address

### ISSUE THREAD

**Issue by kobeyu** [shazow/urllib3#1224]
I originally opened this in [requests](https://github.com/requests/requests/issues/4178), but was asked to raise it here.

When connecting to a machine over https using an IP address, the SSL client hello includes a server_name extension with the ip address listed as the server name. This is not allowed in the [SNI spec](https://tools.ietf.org/html/rfc3546#section-3.1), and it should not include the server_name extension. 

Reproduce:
1. Set up packet logging
2. ```python
    import urllib3
    http = urllib3.PoolManager()
    http.request('GET', 'https://8.8.8.8')
    ````
3. Inspect packet logs for client hello. It'll look a bit like this:
```
Frame 31: 571 bytes on wire (4568 bits), 571 bytes captured (4568 bits) on interface 0
Ethernet II, Src: BizlinkK_XX:XX:XX (9c:eb:e8:XX:XX:XX), Dst: JuniperN_XX:XX:XX (08:81:f4:XX:XX:XX)
Internet Protocol Version 4, Src: 192.168.89.18, Dst: 8.8.8.8
Transmission Control Protocol, Src Port: 1156, Dst Port: 443, Seq: 1, Ack: 1, Len: 517
Secure Sockets Layer
    TLSv1.2 Record Layer: Handshake Protocol: Client Hello
        Content Type: Handshake (22)
        Version: TLS 1.0 (0x0301)
        Length: 512
        Handshake Protocol: Client Hello
            Handshake Type: Client Hello (1)
            Length: 508
            Version: TLS 1.2 (0x0303)
            Random
            Session ID Length: 0
            Cipher Suites Length: 148
            Cipher Suites (74 suites)
            Compression Methods Length: 1
            Compression Methods (1 method)
            Extensions Length: 319
            Extension: server_name
                Type: server_name (0x0000)
                Length: 12
                Server Name Indication extension
                    Server Name list length: 10
                    Server Name Type: host_name (0)
                    Server Name length: 7
                    Server Name: 8.8.8.8
            Extension: ec_point_formats
            Extension: elliptic_curves
            Extension: SessionTicket TLS
            Extension: signature_algorithms
            Extension: Heartbeat
            Extension: Padding
```

The particular server I'm connecting to (azure windows 2016 Datacenter edition) immediately closes the connection when it sees a client hello like this.

**Comment by Lukasa** [comment]
Ok, so this is a thing that's bothered me for a while. SNI absolutely should not have IP addresses in it, but spotting an IP address is a tricky thing to do. I think our best bet is to optionally attempt to import the `ipaddress` module to do IP address detection.

Failing that, if we want an internal utility for this we can write one: it just turns out to be moderately tricky.

Anyone got opinions on this?

**Comment by nitzmahone** [comment]
We're hitting this in pywinrm/Ansible as well if SNI is enabled. I'd be +1 for a lightweight dep on `ipaddress`- we can make it a hard dep for pywinrm just to make sure it's always there for our fairly common use case of someone hitting a WinRM endpoint by IP (in the off chance SNI is enabled on that host)...

**Comment by tiran** [comment]
This is a known bug in Python's ssl module. I'll fix it for 3.7 as soon as I can drop support for OpenSSL < 1.0.2.

**Comment by nitzmahone** [comment]
@tiran done: https://bugs.python.org/issue32185 - I see it's already been default-assigned to you :D

**Comment by tiran** [comment]
@nitzmahone Yeah, I'm the poor soul that has to fix all SSL/TLS issues. :)

**Comment by minusdavid** [comment]
As a user, I can confirm that this SNI IP address issue seems to be a problem when using pywinrm with Windows Server 2012.

I was using IP addresses for two Windows Server 2012 boxes. One was connecting and one was failing with a SSL handshake error. I look at the packets, and when my client sent the IP address, the server rejected the packet. (Same thing worked on the other box though.)

When I hard-coded random hostnames into /etc/hosts with those IP addresses, it worked a treat. Winrm is listening on all addresses and doesn't seem to care what hostname it has so long as it matches the SSL certificate. 

I'm curious now how one determines if SNI is enabled or not... with WinRM or Windows in general. All I see is info about IIS which I assume isn't relevant int he case of WinRM...

**Comment by minusdavid** [comment]
While using IP addresses, client would send a SYN, server would send a SYN-ACK, client would send an ACK, and then the client would send a push packet containing the IP addresses and the server would send a reset packet. 

As soon as I switched to using hostnames, instead of a reset packet, I would get a packet that appeared to contain the SSL certificate or at least some details about it. 

Note that this latter behaviour also happened on one of the Windows machines even when using IP addresses.

Trying to figure out how SNI relates to WinRM...

**Comment by minusdavid** [comment]
Ahh... I take it that both IIS and WinRM use http.sys...

**Comment by nitzmahone** [comment]
ayup

**Comment by minusdavid** [comment]
Still no idea what the difference between those machines was as I think http.sys has SNI enabled by default? The client was exactly the same so I don't see how that could have impacted it. 

I'm guessing maybe it had to do with some IIS sites and differences in configuration there between the servers?

**Comment by nitzmahone** [comment]
It doesn't, but it's global- if one site enables the SNI extension, http.sys will accept/process it on all of them- otherwise it just ignores it.

**Comment by minusdavid** [comment]
Hmm, that doesn't seem to be the case here. It looks like there is one site on the 2nd server with SNI enabled, but I wasn't having any problems with WinRM just using an IP address on that server :/.

**Comment by haikuginger** [comment]
@Lukasa, given that this appears to be something that'll be fixed in Python 3.7, do you think we should proceed with a fix for this in our own code? I agree that if so, a soft dependency on `ipaddress` makes sense.

**Comment by tiran** [comment]
@haikuginger I'm planning to backport the fix to 2.7 and 3.6, too. It will work with most common setups, that is either OpenSSL >= 1.0.2 or LibreSSL >= 2.5.3 or or platforms with ``inet_pton()`` in libc.

You don't need the ``ipaddress`` module. You can simply use the socket module to detect if a string is an IPv4 or IPv6 address. It's faster, too. I proposed a solution on another PR or issue.
