### ISSUE TITLE
HTTP CONNECT missing brackets when connecting to IPV6 host via IPV6 proxy

### ISSUE THREAD

**Issue by friedbutter** [shazow/urllib3#1222]
Currently, I am trying to connect to an https IPv6 host via IPv6 proxy. Here is my example:

```                                                                                                                                                                                                                                                   
import requests
url = 'https://[2620:10d:c081:b:0:0:0:26]/1/self'
r = requests.get( url, proxies={ 'http': '[2401:db00:0020:8065:beaf:0000:0019:0000]:8080', 'https': '[2401:db00:0020:8065:beaf:0000:0019:0000]:8080', }, verify=False )
print(r.content)
```

I got this error:

```
Traceback (most recent call last):
  File "/usr/local/lib/python3.5/site-packages/urllib3/connectionpool.py", line 592, in urlopen
    self._prepare_proxy(conn)
  File "/usr/local/lib/python3.5/site-packages/urllib3/connectionpool.py", line 808, in _prepare_proxy
    conn.connect()
  File "/usr/local/lib/python3.5/site-packages/urllib3/connection.py", line 294, in connect
    self._tunnel()
  File "/usr/local/Cellar/python3/3.5.2_3/Frameworks/Python.framework/Versions/3.5/lib/python3.5/http/client.py", line 832, in _tunnel
    message.strip()))
OSError: Tunnel connection failed: 400 Bad Request

During handling of the above exception, another exception occurred:

Traceback (most recent call last):
  File "/usr/local/lib/python3.5/site-packages/requests/adapters.py", line 439, in send
    timeout=timeout
  File "/usr/local/lib/python3.5/site-packages/urllib3/connectionpool.py", line 647, in urlopen
    _stacktrace=sys.exc_info()[2])
  File "/usr/local/lib/python3.5/site-packages/urllib3/util/retry.py", line 388, in increment
    raise MaxRetryError(_pool, url, error or ResponseError(cause))
urllib3.exceptions.MaxRetryError: HTTPSConnectionPool(host='2620:10d:c081:b:0:0:0:26', port=443): Max retries exceeded with url: /1/self (Caused by ProxyError('Cannot connect to proxy.', OSError('Tunnel connection failed: 400 Bad Request',)))

During handling of the above exception, another exception occurred:

Traceback (most recent call last):
  File "test2.py", line 4, in <module>
    r = requests.get( url, proxies={ 'http': '[2401:db00:0020:8065:beaf:0000:0019:0000]:8080', 'https': '[2401:db00:0020:8065:beaf:0000:0019:0000]:8080', }, verify=False )
  File "/usr/local/lib/python3.5/site-packages/requests/api.py", line 72, in get
    return request('get', url, params=params, **kwargs)
  File "/usr/local/lib/python3.5/site-packages/requests/api.py", line 58, in request
    return session.request(method=method, url=url, **kwargs)
  File "/usr/local/lib/python3.5/site-packages/requests/sessions.py", line 502, in request
    resp = self.send(prep, **send_kwargs)
  File "/usr/local/lib/python3.5/site-packages/requests/sessions.py", line 612, in send
    r = adapter.send(request, **kwargs)
  File "/usr/local/lib/python3.5/site-packages/requests/adapters.py", line 501, in send
    raise ProxyError(e, request=request)
requests.exceptions.ProxyError: HTTPSConnectionPool(host='2620:10d:c081:b:0:0:0:26', port=443): Max retries exceeded with url: /1/self (Caused by ProxyError('Cannot connect to proxy.', OSError('Tunnel connection failed: 400 Bad Request',)))
```

Digging through the logs and pcap, I found that the brackets are missing in `CONNECT`. Here is the output of tshark:

```
Capturing on 'utun1'
  1   0.000000 2620:10d:c081:1133::11b2 -> 2401:db00:20:8065:beaf:0:19:0 TCP  59366 → 8080 [SYN] Seq=0 Win=65535 Len=0 MSS=1340 WS=32 TSval=1044073862 TSecr=0 SACK_PERM=1
  2   0.042774 2401:db00:20:8065:beaf:0:19:0 -> 2620:10d:c081:1133::11b2 TCP  8080 → 59366 [SYN, ACK] Seq=0 Ack=1 Win=28560 Len=0 MSS=1340 SACK_PERM=1 TSval=157458772 TSecr=1044073862 WS=256
  3   0.042892 2620:10d:c081:1133::11b2 -> 2401:db00:20:8065:beaf:0:19:0 TCP  59366 → 8080 [ACK] Seq=1 Ack=1 Win=131456 Len=0 TSval=1044073904 TSecr=157458772
  4   0.043007 2620:10d:c081:1133::11b2 -> 2401:db00:20:8065:beaf:0:19:0 TCP  [TCP segment of a reassembled PDU]
  5   0.086576 2401:db00:20:8065:beaf:0:19:0 -> 2620:10d:c081:1133::11b2 TCP  8080 → 59366 [ACK] Seq=1 Ack=48 Win=28672 Len=0 TSval=157458815 TSecr=1044073904
  6   0.086665 2620:10d:c081:1133::11b2 -> 2401:db00:20:8065:beaf:0:19:0 HTTP  CONNECT 2620:10d:c081:b:0:0:0:26:443 HTTP/1.0
  7   0.086733 2401:db00:20:8065:beaf:0:19:0 -> 2620:10d:c081:1133::11b2 HTTP  HTTP/1.1 400 Bad Request
  8   0.086894 2401:db00:20:8065:beaf:0:19:0 -> 2620:10d:c081:1133::11b2 TCP  8080 → 59366 [FIN, ACK] Seq=129 Ack=48 Win=28672 Len=0 TSval=157458816 TSecr=1044073904
  9   0.086963 2620:10d:c081:1133::11b2 -> 2401:db00:20:8065:beaf:0:19:0 TCP  59366 → 8080 [ACK] Seq=50 Ack=129 Win=131328 Len=0 TSval=1044073947 TSecr=157458815
 10   0.087166 2620:10d:c081:1133::11b2 -> 2401:db00:20:8065:beaf:0:19:0 TCP  59366 → 8080 [ACK] Seq=50 Ack=130 Win=131328 Len=0 TSval=1044073947 TSecr=157458816
 11   0.101217 2620:10d:c081:1133::11b2 -> 2401:db00:20:8065:beaf:0:19:0 TCP  59366 → 8080 [FIN, ACK] Seq=50 Ack=130 Win=131328 Len=0 TSval=1044073961 TSecr=157458816
 12   0.137349 2401:db00:20:8065:beaf:0:19:0 -> 2620:10d:c081:1133::11b2 TCP  8080 → 59366 [RST] Seq=130 Win=0 Len=0
```

Notice, the HTTP CONNECT is invalid

```
6   0.086665 2620:10d:c081:1133::11b2 -> 2401:db00:20:8065:beaf:0:19:0 HTTP  CONNECT 2620:10d:c081:b:0:0:0:26:443 HTTP/1.0
```

**Comment by friedbutter** [comment]
pull request https://github.com/shazow/urllib3/pull/1223

**Comment by sigmavirus24** [comment]
#1223 has merged and thus I am closing this. 🎉
